Context,Topic of discussion,Representative tweet id,Representative tweet
you the GOP cut embassy,0.kids bubble fox source talk rem news scarborough operatives gop nooz,461699943594340353,.@jimcc66 @Maggyw519 @FoxNews @seanhannity your media failed to tell you the GOP cut embassy security. Could that have led to Benghazi?
George W Bush should've been,1.bush cheney george w,461691367958126592,If embassy attacks are impeachable, George W Bush should've been impeached 13 times. @FoxNews @seanhannity #Hannity
your potus And please don't freak,2.benghazi potus,461694264980676609,You Lie! Ha! Just like "your potus"... And please don't freak out when he is #impeached #itscoming @KickAssLiberal @FoxNews @seanhannity
#Hannity If embassy attacks are impeachable,3.embassy security cut,461691367958126592,If embassy attacks are impeachable, George W Bush should've been impeached 13 times. @FoxNews @seanhannity #Hannity
impeached 13 times #Hannity,4.times,461691367958126592,If embassy attacks are impeachable, George W Bush should've been impeached 13 times. @FoxNews @seanhannity #Hannity
SENATE report,5.committees senate intelligence review committee report select,461701946424848384,@jimcc66 @KickAssLiberal @FoxNews @seanhannity there was a terror attack, period. Stop dancing on people graves.Look at the SENATE report
the Obama administration lying #JusticeForBenghazi4,6.obama,461700510894931969,Its about the "Obama administration lying" @KickAssLiberal @Maggyw519 @FoxNews @seanhannity #JusticeForBenghazi4 We will never let this go!!
keeping the truth from you wake,7.truth,461699514361868288,Your media is keeping the truth from you, wake up before its too late @Maggyw519 @KickAssLiberal @FoxNews @seanhannity #Benghazi
was no cover up The,8.cover,461729498845573120,.@jcope12003 @jimcc66 @Maggyw519 did you care about the 13 Benghazis that happened up Bush? There was no cover up. The Review said so
#Benghazi Your media is keeping,9.media,461699514361868288,Your media is keeping the truth from you, wake up before its too late @Maggyw519 @KickAssLiberal @FoxNews @seanhannity #Benghazi
