Context,Topic of discussion,Representative tweet id,Representative tweet
sex work to the right to die,0.escorts workers work worker sex male industry,446547442281242624,In defence of body sovereignty, from sex work to the right to die. My Times column this am - http://t.co/pNzgPyGgs8 (£)
that the women had been pimped,1.friends women,446631796583981057,@DAaronovitch Over half the men knew, prior to buying sex, that the women had been pimped, coerced or trafficked, but it didn't stop them
half the men knew prior,2.men,446631796583981057,@DAaronovitch Over half the men knew, prior to buying sex, that the women had been pimped, coerced or trafficked, but it didn't stop them
feel that prostitution is a,3.proliferates prostitution,446635306079748096,@DAaronovitch @bindelj And yet you feel that prostitution is a free and neutral transaction between the equally powerful.
body sovereignty from sex work to the,4.body sovereignty,446547442281242624,In defence of body sovereignty, from sex work to the right to die. My Times column this am - http://t.co/pNzgPyGgs8 (£)
(£) In defence of body sovereignty from sex,5.defence,446547442281242624,In defence of body sovereignty, from sex work to the right to die. My Times column this am - http://t.co/pNzgPyGgs8 (£)
Times column this am (£),6.column times,446547442281242624,In defence of body sovereignty, from sex work to the right to die. My Times column this am - http://t.co/pNzgPyGgs8 (£)
Hi David I interviewed several,7.david,446620267130146816,@DAaronovitch Hi David. I interviewed several punters in London for research project. It is not a victimless crime: http://t.co/pJZzAsQPdk
The law is unworkable We,8.law,446632737722892288,@DAaronovitch Most women in sex industry fall into that category. The law is unworkable. We need to criminalise buying and decrim the women
interviewed several punters in London for research,9.punters,446620267130146816,@DAaronovitch Hi David. I interviewed several punters in London for research project. It is not a victimless crime: http://t.co/pJZzAsQPdk
